{
  "apiVersion": "runtime.ai.ecosystem/v1alpha1",
  "kind": "AdapterConformanceProfile",
  "metadata": {
    "deploymentId": "local-ollama-qwen3-0.6b",
    "id": "eval-ec9cf9bd500ee279bbc1f21e",
    "testedAt": "2026-07-15T12:58:25.628337Z",
    "validUntil": "2026-07-16T12:58:25.628337Z"
  },
  "spec": {
    "adapterVersion": "ollama-eval-v1",
    "deploymentIdentityDigest": "230d8461ae618f9b8eab69ad0f748db5e8d5b4c8aabb0fad0a71d29e076b14a7",
    "deviationCodes": [],
    "effectiveCapabilities": [
      "model.text"
    ],
    "probes": [
      {
        "attempts": 1,
        "evidenceDigest": "3d4e398190abcb1cf7b4dc8969c929aef3f45f905b0f7a247c2a96ba6814811c",
        "id": "text-basic",
        "metrics": {
          "inputTokens": 44,
          "outputTokens": 2
        },
        "status": "pass",
        "successes": 1
      }
    ],
    "status": "pass",
    "suite": {
      "digest": "08d7ee84c62d53c3ae08419623b48cfb6d645fe8c127ddcd090295e194826dd6",
      "id": "m2-live-local-cloud",
      "version": "1.0.0"
    }
  }
}
