{"apiVersion":"runtime.ai.ecosystem/v1alpha1","kind":"AdapterConformanceProfile","metadata":{"deploymentId":"local-llamacpp-gemma","id":"local-llamacpp-gemma-observation","testedAt":"2026-07-20T08:11:48Z","validUntil":"2026-07-20T12:11:48Z"},"spec":{"adapterVersion":"openai-compatible-v1","deploymentIdentityDigest":"69819b52c15e0ad1b9aed954aaeeec26092c0ad84f15287061f57a5ee17c6c9a","deviationCodes":[],"effectiveCapabilities":["model.text","model.structured-output"],"probes":[{"attempts":1,"evidenceDigest":"954ce97e3abf5bf4da13c5f043f9fda8d59841f9f7ec7e225ffbff06ecd965f8","id":"text-basic","status":"pass","successes":1},{"attempts":1,"evidenceDigest":"cadf69c5dd636a4e2cd49930f37d81f578d516b0427e55b687f408c120dfc972","id":"structured-output-strict","status":"pass","successes":1}],"status":"pass","suite":{"digest":"aa8ed45e3d481a0faf91d442dc2bc4d77f73fdd100d0eb262da64046fa441f5a","id":"adapter-conformance-v1","version":"1.0.0"}}}